{
  "schema_version": 1,
  "revision": "2026-09-09.1",
  "current_release": "v0.9.4",
  "release_source": {
    "provider": "github_release",
    "repository": "optiscaler/OptiScaler"
  },
  "member_catalog": {
    "64b818976dadcae26caa8a80f2ec023c15a0e1b59100fc806740c9ddfbefcbd7": {
      "archive_path": "OptiScaler.dll",
      "target": "$proxy",
      "size": 24933168,
      "module": "core",
      "pe_x64": true
    },
    "cfd085e19f00a9f69fa7c3ff42317f09441ca7867a01ca0d9916d1d334a044d9": {
      "archive_path": "OptiScaler.ini",
      "target": "OptiScaler.ini",
      "size": 43805,
      "module": "core"
    },
    "d98c027fbd4cc074a1c48574eecd58ded2bc9e4cb6bfc5c28d6595ab5037d371": {
      "archive_path": "amd_fidelityfx_dx12.dll",
      "target": "amd_fidelityfx_dx12.dll",
      "size": 25864,
      "module": "ffx_dx12",
      "pe_x64": true
    },
    "8deaf970b84dac8f761fefa546e73517e02b34a6bb05a590a74e7faea03baa4a": {
      "archive_path": "amd_fidelityfx_framegeneration_dx12.dll",
      "target": "amd_fidelityfx_framegeneration_dx12.dll",
      "size": 38246160,
      "module": "ffx_dx12",
      "pe_x64": true
    },
    "ec7ed3ca674e288240e6f04b986342aece47454c41d9b0959449e82e22bd7f6d": {
      "archive_path": "amd_fidelityfx_upscaler_dx12.dll",
      "target": "amd_fidelityfx_upscaler_dx12.dll",
      "size": 15605520,
      "module": "ffx_dx12",
      "pe_x64": true
    },
    "a1624cc4238fef046f30c4d80ce3f47be63fc5f5373f49e3ee9edb9960f54c78": {
      "archive_path": "amd_fidelityfx_vk.dll",
      "target": "amd_fidelityfx_vk.dll",
      "size": 9332432,
      "module": "ffx_vulkan",
      "pe_x64": true
    },
    "07d286c306f8117321422affd9e6388c12d0fb4be1c7fc689d9e899324feeb24": {
      "archive_path": "D3D12_Optiscaler/D3D12Core.dll",
      "target": "D3D12_Optiscaler/D3D12Core.dll",
      "size": 3351064,
      "module": "agility",
      "pe_x64": true
    },
    "92cec26cde3393d0a284eb8fb87b26f0d712fe34dd51f6c0b1596a3380ce38b5": {
      "archive_path": "fakenvapi.dll",
      "target": "fakenvapi.dll",
      "size": 414208,
      "module": "fakenvapi",
      "pe_x64": true
    },
    "a4bfa3ec7b4badd93ae5e1ad74a582238082d871f54f38f68e7d9fb6384ce772": {
      "archive_path": "fakenvapi.ini",
      "target": "fakenvapi.ini",
      "size": 466,
      "module": "fakenvapi"
    },
    "806020c0444f7841a3a9f661295c16fc482e981e0666d0b9624bf6ccd19c4b5e": {
      "archive_path": "dlssg_to_fsr3_amd_is_better.dll",
      "target": "dlssg_to_fsr3_amd_is_better.dll",
      "size": 3038208,
      "module": "nvngx_fsr3_bridge",
      "pe_x64": true
    },
    "61aeeab7fdcfb6d1742f86c14c68c663d759607d01a6132645c857291eaebb86": {
      "archive_path": "libxell.dll",
      "target": "libxell.dll",
      "size": 411504,
      "module": "xess",
      "pe_x64": true
    },
    "251659dd84a3e84de67c886a4186e01f3eca49b00641906fe38bb6b807e5d5b7": {
      "archive_path": "libxess.dll",
      "target": "libxess.dll",
      "size": 77795704,
      "module": "xess",
      "pe_x64": true
    },
    "c7cfe86f0c9d94e4fb3696d3cd5035e2bbb6a8b1b0572f8b7395a4cdfd0c625e": {
      "archive_path": "libxess_dx11.dll",
      "target": "libxess_dx11.dll",
      "size": 156016,
      "module": "xess",
      "pe_x64": true
    },
    "9d074c7cb931d450875373372da832304b82a2dcac51cb17df44b49f00e2961c": {
      "archive_path": "libxess_fg.dll",
      "target": "libxess_fg.dll",
      "size": 22955384,
      "module": "xess",
      "pe_x64": true
    },
    "7d225b8d4d882b1d91e3a17e93b017c038b126462ff00fac0baf788f046822a8": {
      "archive_path": "OptiScaler.dll",
      "target": "$proxy",
      "size": 25036080,
      "module": "core",
      "pe_x64": true
    },
    "b0665bba3deb621e2e9d0a64b44c5c1bd066f7d632eba604054e9a9a39849fce": {
      "archive_path": "OptiScaler.ini",
      "target": "OptiScaler.ini",
      "size": 45155,
      "module": "core"
    },
    "373e73dc06e2d66e90083fde3bc99ef5c1ed0bef98d1f7eda56c8b073269c3f1": {
      "archive_path": "fakenvapi.dll",
      "target": "fakenvapi.dll",
      "size": 415232,
      "module": "fakenvapi",
      "pe_x64": true
    },
    "ec5e0c65e075570c6ede72618bb666d0be0c2e10b2ea9762c0fe8cb8e375ab27": {
      "archive_path": "libxess_fg.dll",
      "target": "libxess_fg.dll",
      "size": 22957432,
      "module": "xess",
      "pe_x64": true
    },
    "62022e09a6679b12485da569f857220132155bfd2375fe01b4f232e306a76da6": {
      "archive_path": "OptiScaler.dll",
      "target": "$proxy",
      "size": 25217840,
      "module": "core",
      "pe_x64": true
    },
    "c676faf6ee2c4e1e35b474fc017fe0aa90a30da08530b02b02f980175a4850ae": {
      "archive_path": "OptiScaler.ini",
      "target": "OptiScaler.ini",
      "size": 46397,
      "module": "core"
    },
    "2369120927264bb2b120e7fb0940cb0b3242dc788417ab92fb99953555016511": {
      "archive_path": "OptiScaler.dll",
      "target": "$proxy",
      "size": 25356592,
      "module": "core",
      "pe_x64": true
    },
    "ae062683054c9d1f1e1c2c5658cf863012c6c6c4b50771edc9987f36b44547ec": {
      "archive_path": "OptiScaler.ini",
      "target": "OptiScaler.ini",
      "size": 47360,
      "module": "core"
    },
    "fbfb6676b829dad7e020fb830586a16aa0ec6add78016db48ef12e2ae1803231": {
      "archive_path": "OptiScaler.dll",
      "target": "$proxy",
      "size": 25379632,
      "module": "core",
      "pe_x64": true
    },
    "6d7ed07e2e9df3d611b6f59047716bcbc0b67834296b8e4414816189b1233aa7": {
      "archive_path": "OptiScaler.ini",
      "target": "OptiScaler.ini",
      "size": 47477,
      "module": "core"
    },
    "e2d85aa05a9bd9ed8b38935fdf5199372cca6f74c12015143bb6f945ee1608aa": {
      "archive_path": "amd_fidelityfx_dx12.dll",
      "target": "amd_fidelityfx_dx12.dll",
      "size": 26376,
      "module": "ffx_dx12",
      "pe_x64": true
    },
    "02297beedd285e822d3a64f314cf00faf378dcec0edc47ff0c4dd71b3a8c2f18": {
      "archive_path": "amd_fidelityfx_framegeneration_dx12.dll",
      "target": "amd_fidelityfx_framegeneration_dx12.dll",
      "size": 40085776,
      "module": "ffx_dx12",
      "pe_x64": true
    },
    "d0dcccc74a43c44ba435b7a369b456e0970d8a4464e4bd683119b374f2c9fb46": {
      "archive_path": "amd_fidelityfx_upscaler_dx12.dll",
      "target": "amd_fidelityfx_upscaler_dx12.dll",
      "size": 28761864,
      "module": "ffx_dx12",
      "pe_x64": true
    }
  },
  "releases": [
    {
      "id": "v0.9.0",
      "asset": "Optiscaler_0.9.0-final.20260401._AF.7z",
      "archive_sha256": "a988ce2c0a86bba58a6313659d1ed2ab78f994dbdfab246394a2e4293ac68010",
      "archive_size": 53353132,
      "config_schema": 1,
      "members": [
        "64b818976dadcae26caa8a80f2ec023c15a0e1b59100fc806740c9ddfbefcbd7",
        "cfd085e19f00a9f69fa7c3ff42317f09441ca7867a01ca0d9916d1d334a044d9",
        "d98c027fbd4cc074a1c48574eecd58ded2bc9e4cb6bfc5c28d6595ab5037d371",
        "8deaf970b84dac8f761fefa546e73517e02b34a6bb05a590a74e7faea03baa4a",
        "ec7ed3ca674e288240e6f04b986342aece47454c41d9b0959449e82e22bd7f6d",
        "a1624cc4238fef046f30c4d80ce3f47be63fc5f5373f49e3ee9edb9960f54c78",
        "07d286c306f8117321422affd9e6388c12d0fb4be1c7fc689d9e899324feeb24",
        "92cec26cde3393d0a284eb8fb87b26f0d712fe34dd51f6c0b1596a3380ce38b5",
        "a4bfa3ec7b4badd93ae5e1ad74a582238082d871f54f38f68e7d9fb6384ce772",
        "806020c0444f7841a3a9f661295c16fc482e981e0666d0b9624bf6ccd19c4b5e",
        "61aeeab7fdcfb6d1742f86c14c68c663d759607d01a6132645c857291eaebb86",
        "251659dd84a3e84de67c886a4186e01f3eca49b00641906fe38bb6b807e5d5b7",
        "c7cfe86f0c9d94e4fb3696d3cd5035e2bbb6a8b1b0572f8b7395a4cdfd0c625e",
        "9d074c7cb931d450875373372da832304b82a2dcac51cb17df44b49f00e2961c"
      ]
    },
    {
      "id": "v0.9.1",
      "asset": "Optiscaler_0.9.1-final.20260427._DSB.7z",
      "archive_sha256": "56d1a18e3a32d978c0134844e803ba8cf04134226cfcdb8283f68d180836fab0",
      "archive_size": 53342538,
      "config_schema": 1,
      "members": [
        "7d225b8d4d882b1d91e3a17e93b017c038b126462ff00fac0baf788f046822a8",
        "b0665bba3deb621e2e9d0a64b44c5c1bd066f7d632eba604054e9a9a39849fce",
        "d98c027fbd4cc074a1c48574eecd58ded2bc9e4cb6bfc5c28d6595ab5037d371",
        "8deaf970b84dac8f761fefa546e73517e02b34a6bb05a590a74e7faea03baa4a",
        "ec7ed3ca674e288240e6f04b986342aece47454c41d9b0959449e82e22bd7f6d",
        "a1624cc4238fef046f30c4d80ce3f47be63fc5f5373f49e3ee9edb9960f54c78",
        "07d286c306f8117321422affd9e6388c12d0fb4be1c7fc689d9e899324feeb24",
        "373e73dc06e2d66e90083fde3bc99ef5c1ed0bef98d1f7eda56c8b073269c3f1",
        "a4bfa3ec7b4badd93ae5e1ad74a582238082d871f54f38f68e7d9fb6384ce772",
        "806020c0444f7841a3a9f661295c16fc482e981e0666d0b9624bf6ccd19c4b5e",
        "61aeeab7fdcfb6d1742f86c14c68c663d759607d01a6132645c857291eaebb86",
        "251659dd84a3e84de67c886a4186e01f3eca49b00641906fe38bb6b807e5d5b7",
        "c7cfe86f0c9d94e4fb3696d3cd5035e2bbb6a8b1b0572f8b7395a4cdfd0c625e",
        "ec5e0c65e075570c6ede72618bb666d0be0c2e10b2ea9762c0fe8cb8e375ab27"
      ]
    },
    {
      "id": "v0.9.2",
      "asset": "Optiscaler_0.9.2a-final.20260517._Reup.7z",
      "archive_sha256": "6426a16085f6128c810e0de58947029664439afd0567b6a286c0e3ef784a92a1",
      "archive_size": 53388454,
      "config_schema": 1,
      "members": [
        "62022e09a6679b12485da569f857220132155bfd2375fe01b4f232e306a76da6",
        "c676faf6ee2c4e1e35b474fc017fe0aa90a30da08530b02b02f980175a4850ae",
        "d98c027fbd4cc074a1c48574eecd58ded2bc9e4cb6bfc5c28d6595ab5037d371",
        "8deaf970b84dac8f761fefa546e73517e02b34a6bb05a590a74e7faea03baa4a",
        "ec7ed3ca674e288240e6f04b986342aece47454c41d9b0959449e82e22bd7f6d",
        "a1624cc4238fef046f30c4d80ce3f47be63fc5f5373f49e3ee9edb9960f54c78",
        "07d286c306f8117321422affd9e6388c12d0fb4be1c7fc689d9e899324feeb24",
        "373e73dc06e2d66e90083fde3bc99ef5c1ed0bef98d1f7eda56c8b073269c3f1",